<?xml version="1.0" encoding="UTF-8" ?>

<reports xmlns:xsi="http://www.w3.org/2001/XMLSchema-instance"
         xsi:noNamespaceSchemaLocation="reports.xsd">

    <scopes>
        <scope>
            <name>jade</name>
            <module>common-api</module>
            <class-name>cz.cesnet.shongo.JadeReportSet</class-name>
        </scope>

        <scope>
            <name>common</name>
            <module>common-api</module>
            <class-name>cz.cesnet.shongo.CommonReportSet</class-name>
        </scope>

        <scope>
            <name>controller</name>
            <module>controller-api</module>
            <class-name>cz.cesnet.shongo.controller.ControllerReportSet</class-name>
        </scope>

        <scope>
            <name>scheduler</name>
            <module>controller</module>
            <class-name>cz.cesnet.shongo.controller.scheduler.SchedulerReportSet</class-name>
            <messages>
                <module>controller-api</module>
                <class-name>cz.cesnet.shongo.controller.AllocationStateReportMessages</class-name>
            </messages>
        </scope>

        <scope>
            <name>executor</name>
            <module>controller</module>
            <class-name>cz.cesnet.shongo.controller.executor.ExecutionReportSet</class-name>
            <messages>
                <module>controller-api</module>
                <class-name>cz.cesnet.shongo.controller.ExecutionReportMessages</class-name>
            </messages>
        </scope>
    </scopes>

    <scope name="jade">

        <template extends="cz.cesnet.shongo.JadeReport">
            <serializable>true</serializable>
            <exception base-class="cz.cesnet.shongo.JadeException"/>
        </template>

        <report>
            <id>unknown-error</id>
            <classification severity="error"/>
            <params>
                <param name="description" type="String"/>
            </params>
            <description>
                TODO:
            </description>
            <message>
                Unknown error: ${description}
            </message>
            <example>
                TODO:
            </example>
            <resolution>stop</resolution>
        </report>

        <report>
            <id>agent-not-found</id>
            <classification severity="error"/>
            <params>
                <param name="receiverAgent" type="String"/>
            </params>
            <description>
                TODO:
            </description>
            <message>
                Receiver agent ${receiverAgent} is not available now.
            </message>
            <example>
                TODO:
            </example>
            <resolution>try-again</resolution>
        </report>

        <report>
            <id>agent-not-started</id>
            <classification severity="error"/>
            <params>
                <param name="senderAgent" type="String"/>
            </params>
            <description>
                TODO:
            </description>
            <message>
                Sender agent ${senderAgent} is not started yet.
            </message>
            <example>
                TODO:
            </example>
            <resolution>try-again</resolution>
        </report>

        <report abstract="true">
            <id>command-abstract-error</id>
            <classification severity="error"/>
            <params>
                <param name="command" type="String"/>
            </params>
            <description>
                TODO:
            </description>
            <message>
                Abstract command error.
            </message>
        </report>

        <report extends="command-abstract-error">
            <id>command-unknown-error</id>
            <params>
                <param name="description" type="String"/>
            </params>
            <description>
                TODO:
            </description>
            <message>
                Unknown error in command ${command}: ${description}
            </message>
            <example>
                TODO:
            </example>
            <resolution>stop</resolution>
        </report>

        <report extends="command-abstract-error">
            <id>command-timeout</id>
            <params>
                <param name="receiverAgent" type="String"/>
            </params>
            <description>
                TODO:
            </description>
            <message>
                Command ${command} send to ${receiverAgent} has timeout.
            </message>
            <example>
                TODO:
            </example>
            <resolution>try-again</resolution>
        </report>

        <report extends="command-abstract-error">
            <id>command-not-supported</id>
            <params>
                <param name="receiverAgent" type="String"/>
            </params>
            <description>
                TODO:
            </description>
            <message>
                Receiver agent ${receiverAgent} doesn't implement command ${command}.
            </message>
            <example>
                TODO:
            </example>
            <resolution>stop</resolution>
        </report>

        <report extends="command-abstract-error">
            <id>command-refused</id>
            <params>
                <param name="receiverAgent" type="String"/>
            </params>
            <description>
                TODO:
            </description>
            <message>
                Receiver agent ${receiverAgent} has refused command ${command}.
            </message>
            <example>
                TODO:
            </example>
            <resolution>stop</resolution>
        </report>

        <report extends="command-abstract-error">
            <id>command-not-understood</id>
            <params>
                <param name="receiverAgent" type="String"/>
            </params>
            <description>
                TODO:
            </description>
            <message>
                Receiver agent ${receiverAgent} didn't understand command ${command}.
            </message>
            <example>
                TODO:
            </example>
            <resolution>stop</resolution>
        </report>

        <report extends="command-abstract-error">
            <id>command-failed</id>
            <classification severity="error"/>
            <params>
                <param name="receiverAgent" type="String"/>
                <param name="code" type="String"/>
                <param name="reason" type="String"/>
            </params>
            <description>
                TODO:
            </description>
            <message>
                Receiver agent ${receiverAgent} failed to perform command ${command}: ${reason}
            </message>
            <message for="user">
                ${reason}
            </message>
            <example>
                TODO:
            </example>
            <resolution>stop</resolution>
        </report>

        <report extends="command-abstract-error">
            <id>command-result-decoding-failed</id>
            <classification severity="error"/>
            <params>
                <param name="senderAgent" type="String"/>
            </params>
            <description>
                TODO:
            </description>
            <message>
                Sender agent ${senderAgent} cannot decode response from command ${command}.
            </message>
            <example>
                TODO:
            </example>
            <resolution>stop</resolution>
        </report>

    </scope>

    <scope name="common">

        <template>
            <api-fault>true</api-fault>
            <api-fault-code>0</api-fault-code>
            <exception runtime="true"/>
        </template>

        <report>
            <id>unknown-error</id>
            <classification severity="error"/>
            <params>
                <param name="description" type="String"/>
            </params>
            <description>
                TODO:
            </description>
            <message>
                Unknown error: ${description}
            </message>
            <message for="user">Unknown error.</message>
            <example>
                TODO:
            </example>
            <visible>domain-admin user</visible>
        </report>

        <report>
            <id>type-mismatch</id>
            <classification severity="error"/>
            <params>
                <param name="requiredType" type="String"/>
                <param name="presentType" type="String"/>
            </params>
            <description>
                TODO:
            </description>
            <message>
                Type mismatch. Present type ${presentType} doesn't match required type ${requiredType}.
            </message>
            <example>
                TODO:
            </example>
            <visible>user</visible>
        </report>

        <report>
            <id>type-illegal-value</id>
            <classification severity="error"/>
            <params>
                <param name="type" type="String"/>
                <param name="value" type="String"/>
            </params>
            <description>
                TODO:
            </description>
            <message>
                Value ${value} is illegal for type ${type}.
            </message>
            <example>
                TODO:
                -Enum
                -Date/Time
                -Period
                -Interval
                -Partial Date/Time
                -DeviceResource.Mode
            </example>
            <visible>user</visible>
        </report>

        <report>
            <id>value-maximum-length-exceeded</id>
            <classification severity="error"/>
            <params>
                <param name="value" type="String"/>
                <param name="maximumLength" type="Integer"/>